,id,screen_name,location,created_at,text,retweet_count,followers_count,language,friends_count,verified,title,category,content,date
757,757,hirunews,Colombo,2023-05-20 08:45:57+00:00,අතිපූජ්‍ය දොඩම්පහළ චන්දසිරි නාහිමියන්ගේ ආදාහන පූජෝත්සවය පූර්ණ රාජ්‍ය ගෞරව සහිතව හෙට,1,178509,si,73,FALSE,අතිපූජ්‍ය දොඩම්පහළ චන්දසිරි නා හිමියන්ගේ ආදාහන පූජෝත්සවය හෙට (වීඩියෝ),,අපව වී වදාළ අමරපුර මහා නිකායේ උත්තරීතර මහා නායක අග්ගමහා පණ්ඩිත අතිපූජ්ය දොඩම්පහළ චන්දසිරි නා හිමියන්ගේ ශ්රී දේහය පිලිබඳ ආදාහන පූජෝත්සවය හෙට පස්වරුවේ පූර්ණ රාජ්ය ගෞර සහිතව කොළඹ නිදහස් චතුරස්රෙය්දී සිදු කිරීමට නියමිතයිඋන්වහන්සේගේ ශ්රී දේහය මේ වනවිට රාජගිරිය ගෝතම තපෝවන විහාරස්ථානයේ තැන්පත් කර තිබෙනවාඅමරපුර මහා නිකායේ උත්තරීතර මහ නායක අග්ගමහා පණ්ඩිත අතිපූජ්ය දොඩම්පහළ චන්දසිරි මහ නාහිමියන් ශ්රී දේහය අවසන් ගෞර පුද කිරීමට විශාල පිරිසක් මේ වනවිට රාජගිරිය ගෝතම තපෝවන විහාරස්ථාන වෙත පැමිණෙමින් සිටිනවාමල්වතු මහා විහාර පාර්ශවයේ අනුනායක අතිපූජ්ය නියංගොඩ විජිතසිරි හිමියන්ද උන් වහන්සේ ශ්රී දේහය අවසන් ගෞර දැක්වී සදහා වැඩම කර සිටියාමේ අතර හිටපු ජනපති මෛත්රිපාල සිරිසේන කතානායක මහින්ද යාපා අබේවර්ධන ඇතුළු දේශපාලනඟයින් රැසක් උන්වහන්සේගේ ශ්රී දේහය අවසන් ගෞර දැක්වී සඳහා එක්ව සිටියාඅමරපුර මහා නිකායේ උත්තරීතර මහ නායක අග්ගමහා පණ්ඩිත අතිපූජ්ය දොඩම්පහළ චන්දසිරි මහ නාහිමියන් ශ්රී ජයවර්ධනපුර රෝහලේදී අපව වන විට වැනි වියේ පසුවුණාඅපවත් වී වදාළ අතිපූජ්ය දොඩම්පහළ චන්දසිරි මහ නාහිමියන් ශ්රී දේහය මේ වනවිට රාජගිරිය ගෝතම තපෝවන විහාරස්ථානයේ තැන්පත් කර තිබෙන අතර ආදාහන පූජෝත්සවය හෙට පස්වරුවේ පූර්ණ රාජ්ය ගෞර සහිතව කොළඹ නිදහස් චතුරශ්රයේ දී සිදු කිරීමට නියමිතයි,"Saturday, 20 May 2023 - 13:30"
758,758,hirunews,Colombo,2023-05-20 07:52:06+00:00,අසනීප තරුණියකට සිත් පිත් නැති මිනිසුන් කළ අපරාධය ගංජා මිශ්‍ර රොටියකුත් කවලා,3,178509,si,73,FALSE,තරුණියකට අතවර කළ පූජකවරයෙකු අත්අඩංගුවට,,අසනීපයකට ප්රතිකාර කරන මුවාවෙන් තරුණියක් දූෂණ කළ කෝවිලක පූජකවරයෙකු ඔඩ්ඩුසුඩාන්පොලීසිය විසින් ඊය අත්අඩංගුව ගෙන තිබෙනවාඅදාළ තරුණිය වයස අවුරුදු ක් වන එම ප්රදේශයයේ පදිංචිකාරියක්ඇයට තිබූ අසනීප තත්ත්වයක් පූජකයාට පැවසීමෙන් අනතුරුව එය ප්රතිකාර ලෙස ගංජා මිශ්ර රොටි ආහාරය ලබාදී මත් පැන් පොවා අදාළැ තරුණිය දුෂණයට ලක්කර ඇති බව මූලික පොලිස් විමර්ශනවල දී අනාවරණ වී ඇත්තේ සිදුවීමට සම්බන්ධ පූජකවරයාට ආධාර අනුබල දුන් කාන්තාවක් හා පිරිමි පුද්ගලයින් දෙදෙනෙකු ද අත්අඩංගුව ගත් බව පොලිසිය සඳහන් කළේ,"Saturday, 20 May 2023 - 12:11"
760,760,hirunews,Colombo,2023-05-20 06:18:33+00:00,දහස් ගණන් ගිණුම් ඉවත් කරයි ඔබේ ගිණුම රැකගන්න නම් කළ යුතු දේ මෙන්න,7,178509,si,73,FALSE,භාවිතා නොකරන පරණ Google ගිණුම් ඉවත් කරයි,,වසර දෙකක වැඩි කාලයක් භාවිතා නොකර අක්රියව ඇති ගිණුම් ඉවත් කිරීමට එම සමාගම තීරණය කර තිබෙනව ඒ අනුව ගූගල් සමාගමේ අක්රිය කිරීමේ ප්රතිපත්ති මාලාව යාවත්කාලීන කිරීමට එම සමාගම කටයුතු කර තිබෙනව මෙම ප්රතිපත්ති මාලාව මැයි වැනි දා සිට බලපැවැත්වෙන අතර දෙසැම්බර් මාසයේ සිට අක්රිය ගිණුම් ඉවත් කිරීමට කටයුතු කිරීම ආරම්භ කරන බව ගූගල් සමාගම පවසන්නේඑලෙස ගූගල් ගිණුම මකා දැමීමෙන් අනතුරුව එම ගිණුමට සම්බන්ධ සහ වැනි සේවාවන් ද අක්රිය වන බව එම සමාගම වැඩි දුරටත සඳහන් කර ඇත්තේමෙලෙස එම ගිණුම් මකා දැමීමට පෙර දැනුම්වත් කිරීම් කිහිපයක් සිදු කරන බව ඒ සඳහා ද නිසි පරිදි ප්රතිචාර දැක්වීමක් සිදු නොකළහොත් ගිණුම මකා දැමෙන ඇති බව එම සමාගමේ පවසනවාකෙසේවෙතත් ගූගල් ගිණුම ඉවත් කිරීම වැළැක්වීම සඳහා සක්රීය ආකාරයෙන් පවත්වා ගන්නා ආකාරයත් පැහැදිලි කිරීමට එම සමාගම කටයුතු කර තිබුණා ඒ අනුව වසර දෙකක් අක්රියව පැවති ගූගල් ගිණුමට එක් වරක් වීමෙන් එම ගිණුම ඉවත් කිරීම වැළැක්වීම හැකියා ලැබෙනවාමීට අමතර ඊ මේල් යැවීම කියවී භාවිතය භාවිතය භාවිතය භාවිතය තෙවන පාර්ශවිය හෝ සඳහා එක භාවිතයෙන් වීම වැනි දේවල තුළින් පහසුවෙන් එකේ සක්රීය භාවය පවත්වා ගත හැකි බව එම සමාගම හෙළි කළා,"Friday, 19 May 2023 - 22:59"
761,761,hirunews,Colombo,2023-05-20 06:13:52+00:00,විදෙස් කටයුතු ඇමති කැනේඩියානු මහ කොමසාරිස්ව කොළඹට කැඳවයි,1,178509,si,73,FALSE,විදේශ කටයුතු අමාත්‍යවරයා කැනේඩියානු මහ කොමසාරිස් කොළඹට කැඳවයි (වීඩියෝ),,ශ්රී ලංකාවේ යුද ගැටුම් පැවති සමයේ දෙමළ ජන සංහාරය සිදු වූ බවට කැනේඩියානු අග්රාමාත් ජස්ටින් ටෲඩෝ කළ ප්රකාශය සම්බන්ධ ශ්රී ලංකාවේ විරෝධය ඉදිරිපත් කිරීම සඳහා මෙරට කැනඩා මහකොමසාරිස්වරයාව විදේශ කටයුතු අමාත්යාංශ කැඳවා තිබෙනවානිවේදනයක් නිකුත් කරමින් එම අමාත්යාංශ සඳහන් කළේ විදේශ කටයුතු අමාත්ය ජනාධිපති නීතිඥ අලි සබ්රි ඊයේ දිනයේ මෙම කැඳවීම සිදුකර තිබූ බවයිමෙරට තුළ තිස්වසරක් පුරා ක්රියාත්මකව පැවති රුදුරු ත්රස්තවාද නිමා කිරීමේ විජයග්රහණ සැමරුම යෙදී තිබූ මැයි වනදා දිනය සම්බන්ධ කැනේඩියානු අග්රාමාත් ජස්ටින් ටෲඩෝ නිවේදනයක් නිකුත් කර තිබුණාඑහි දැක්වුණේ මැයි වනදා යනු දෙමළ ජන සංහාරය සිදු වූ දිනයක් බව වසරක පෙර දෙමළ ජනතාව දහස් ගණනක දිවි අහිමි වූ බව මුල්ලි වයික්කාල හි සමූල ඝාතන ඊට නිදසුනක් බව කැනේඩියානු අග්රාමාත්යවරයා නිකුත් කළ එම නිවේදනයේ සඳහන්දෙමළ වැසිය තවම අතුරුදන්ව සිටින බව පවසන කැනේඩියානු අග්රාමාත්යවරයා පෙන්වා දෙන්නේ මානව හිමිකම් සාමය සහ ප්රජාතන්ත්රවාද කිසිවිටෙක ඉවත දැමිය නොහැකි බවයිකෙසේවෙතත් මේ සම්බන්ධ මෙරට විදේශ කටයුතු අමාත්යාංශ දැඩි ප්රතිචාරය දක්වා තිබූ අතර සාමය සහ සංහිඳියා ප්රවර්ධන කිරීම වෙනුවට රටක ප්රමුඛ පෙළේ නායකයෙකු මෙවැනි වගකීම් විරහිත සහ පක්ෂග්රාහී ප්රකාශ කිරීම හෙළා දැක තිබුණාඑමෙන්ම මෙරට කැනේඩියානු මහකොමසාරිස් එරික් වොල්ෂ් මහතාව ඊයේ දිනයේ විදේශ කටයුතු අමාත්යාංශ වෙත කැඳවා විදේශ කටයුතු අමාත්ය අලි සබ්රි මහතා සිය විරෝධය පළ කර තිබෙනවාදේශපාලන නැඹුරුව සහිත මෙම ප්රකාශය මතභේදාත්මක ප්රකාශයක් බව ඒය කැනඩාවේ අභ්යන්තර දේශපාලන අවශ්යතා සඳහා නිකුත් කළ නිවේදනයක් බව අමාත්යවරය මෙහිදී පවසා තිබුණාජන සංහාරය පිළිබඳව ඉදිරිපත්ව ඇති මෙම පදනම් විරහිත චෝදනාව ශ්රී ලංකා රජය තරය ප්රතික්ෂේප කරන බව පවසා ඇති අමාත්යවරය මෙම සාවද්ය චෝදනා මෙහෙයවනු ලබන්නේ ඩයස්පෝරා සිටින බෙදුම්වාදී න්යාය පත්රයක සහිත සහ දේශපාලනික වශයෙන් පොළඹවන ලද ශ්රී ලංකා විරෝධී සුළුතරයක් විසින් බවද අවධාරණ කර තිබෙනවාශ්රී ලංකා රජය ආර්ථික ස්ථාවරත්වයසාමය සහ ප්රතිසන්ධාන ස්ථාපිත කිරීම සඳහා කටයුතු කරමින් සිටින මෙම සුවිශේෂී අවස්ථාවේ කැනේඩියානු අග්රාමාත්යවරයා කළ ඇති මෙම චෝදනා හේතුවෙ ශ්රී ලාංකිකයන ධ්රැවීකරණයට ලක්විය හැකි බවද පවසා තිබුණා,"Saturday, 20 May 2023 - 11:25"
762,762,hirunews,Colombo,2023-05-20 06:13:22+00:00,උණුසුම් කාලගුණය ගැන නිවේදනයක්,2,178509,si,73,FALSE,දිස්ත්‍රික්ක රැසකට උණුසුම් කාලගුණයක්,,උතුරු උතුරුමැද සහ නැගෙනහිර පළාත් සඳහා සහ හම්බන්තොට මොනරාගල යන දිස්ත්රික්කවල උෂ්ණතවය ඉහළ ගොස් ඇති බව කාලගුණ විද්යා දෙපාර්තමේන්තුව නිවේදන කරනවාදිවයින දිස්ත්රික්ක රැසක බලපා ඇති උණුසුම සහිත කාලගුණ තත්ත්වය නිරිත දිග මෝසම ආරම්භ වන තෙක් පවතිනු ඇති බව කාලගුණ විද්යා දෙපාර්තමේන්තුව පවසනවාඒ අනුව එළැඹෙන වනදාත් වනදාත් අතර කාලයේදී නිරිත දිග මෝසම සක්රීය වනු ඇතැයි එම දෙපාර්තමේන්තුව සඳහන් කළාකෙසේ වෙතත් මෙම අධික උෂ්ණත්ව හමුවේ ජනතාවට හිරු එළිය නිරාවරණය වීමේ දී ප්රවේශම් වන ලෙසයි කාලගුණ විද්යා දෙපාර්තමේන්තුව සඳහන් කළේ,"Saturday, 20 May 2023 - 10:18"
763,763,hirunews,Colombo,2023-05-20 03:56:01+00:00,විදුලිබල මණ්ඩලයේ ප්‍රතිව්‍යුහගත කිරීමේ වැඩපිළිවෙල ගැන සාකච්ඡාවක්,1,178509,si,73,FALSE,විදුලිබල මණ්ඩලයේ ප්‍රතිව්‍යුහගත කිරීමේ වැඩපිළිවෙල ගැන සාකච්ඡාවක්,,මෙරටට පැමිණ සිටින ලෝක බැංකුවේ බලශක්ති අංශ නීති විශ්ලේෂක ජෝන් ගලිවර් සහ ආයතනය මඟින් ලබා දී ඇති බලශක්ති ප්රතිව්යුහගත කිරීම් උපදේශක හේමන්ත් සහයි සමඟ බලශක්ති අමාත්ය කංචන විජේසේකර විශේෂ සාකච්ඡාවක් පවත්වා තිබෙනවාඔවුන් පසුගිය දා මෙරටට පැමිණියේ විදුලි බල මණ්ඩලයේ ප්රතිව්යුහගත කිරීමේ වැඩපිළිවෙලට සහය ලබාදී වෙනුවෙන්පැවති හමුවේ දී විදුලිබල මණ්ඩල ප්රතිව්යුහගත කිරීමේ පනත සහ සංක්රාන්ති කාලරාමුව පිළිබඳව ඔවුන්ගේ අදහස් සාකච්ඡාවට ලක් වූ බව අමාත්යවරය සඳහන් කළාඉදිරි දින කීපය තුළ විදුලිබල මණ්ඩල ප්රව්යුහගත කිරීමේ කමිටුවේ සාමාජිකයන් ආසියානු සංවර්ධන බැංකුව ලෝක බැංකුව සහ සංවර්ධන නියෝජිත ආයතන මඟින්තාක්ෂණික සහය ලබාගැනීමට ලබා දී ඇති සියලුම උපදේශකයන් සමග සාකච්ඡා කිරීමට නියමිතයි,"Saturday, 20 May 2023 - 9:13"
764,764,hirunews,Colombo,2023-05-20 03:55:39+00:00,උසස්පෙළ පිළිතුරු පත්‍ර ඇගයීම අද සිට,1,178509,si,73,FALSE,උසස්පෙළ තවත් විෂයන් 11 ඇගයීම් කටයුතු ඇරඹේ,,උසස්පෙළ පිළිතුරු ඇගයීම අදාළව තවත් විෂයන් ක ඇගයීම් කටයුතු මධ්යස්ථාන කදී අද සිට ආරම්භ කරන බව විභාග දෙපාර්තමේන්තුව පවසනවාවිභාග කොමසාරිස් ජනරාල් අමිත ජයසුන්දර ප්රකාශ කළේ විෂයන් ක ඇගයීම් කටයුතු මේවනවිට අවසන් කර ඇති බවයිඇගයීම් කටයුතු අවසන් කළ උත්තර පත්ර විභාග දෙපාර්තමේන්තුව වෙත ගෙන ඒම පියවර ගෙන ඇති බවද විභාග කොමසාරිස්වරයා සඳහන් කර සිටියාසාමාන්ය ඉංග්රීසි විෂයට අදාළව පිළිතුරු පත්ර ඇගයීම් කටයුතු මධ්යස්ථාන ට ආසන්න සංඛ්යාවකදී ලබන වනදා සිට ආරම්භ කිරීමට සැලසුම් කර තිබෙනව සියලු විෂයන්වල පිළිතුරු පත්ර ඇගයීම් කටයුතු සඳහා පාලක පිළිතුරු පත්ර ලකුණු කිරීම අවසන් කර ඇති අතර එහි ඇගයීම් කටයතු අධ්යයන පොදු සහතික පත්ර සාමාන් පෙළ විභාගයෙන් අනතුරුව සිදුකරන බව විභාග කොමසාරිස් ජනරාල් අමිත ජයසුන්දර සඳහන් කරන්නේ,"Saturday, 20 May 2023 - 8:52"
765,765,hirunews,Colombo,2023-05-20 03:13:00+00:00,බොරැල්ලේ වෙඩි තැබීමක්,1,178509,si,73,FALSE,බොරැල්ලේ වෙඩි තැබීමක් (වීඩියෝ),,බොරැල්ල ප්රදේශයේ අද පෙරවරුවේ සිදුවු වෙඩි තැබීමකින් පුද්ගලයෙකු මියගොස් තිබෙනවාපොලීසිය පැවසුවේ යතුරු පැදියකින් පැමිණි දෙදෙනෙක් මෙම වෙඩි තැබීම සිදුකර පළා ගොස් ඇති බවයිබොරැල්ල ලෙස්ලි රණගල මාවතේ දුම්රිය හරස් මාර්ගය අසළ දි අද පෙරවරු ට පමණ මෙම වෙඩි තැබීම සිදු කර තිබුණාපොලීසිය පැවසුවේ යතුරු පැදියකින් පැමිණි දෙදෙනෙක් ටි ගිනි අවියකින් වෙඩි තැබීම සිදු කර පළා ගොස් ඇති බවයිවෙඩි වැදීමෙන් බරපතල තුවාල ලැබූ පුද්ගලයා කඩිනමි කොළඹ ජාතික රෝහලට ඇතුළත් කිරීමට පියවර ගත් නමුත් එහිදි ඔහු මියගොස් තිබෙනවාමියගිය පුද්ගලයා කැලණිය ප්රදේශයේ පදිංචි හැවිරිදි පුද්ගලයෙ බව පොලීසිය සදහන් කළාමෙතෙක් කරන ලද විමර්ශනවලදි අනාවරණ වි ඇත්තේ ඝාතනයට ලක් වු පුද්ගලයා මේජර් මුතාලිෆ් ඝාතනයේ සැකකරු ලෙස අත්අඩංගුව ගෙන නිදහස් වු අයෙක බවයිඔහු පුද්ගලික ආයතනවල සේවකයින් සැපයීමේ සේවාවක පවත්වාගෙන යන අයෙක්එම පුද්ගලයින් වැටුප් ලබාදී සඳහා රණගල මාවතේ පිහිටි සිය සහෝදරියකගේ නිවසක අද පෙරවරුවේ ඔහු පැමිණ තිබුණාඔහුත් සමඟ ඔහුගේ දියණියත් පැමිණ තිබු අතර එම දියණිය මුදල් රැගෙන සහෝදරියගේ නිවසට ගිය අවස්ථාවේදි යතුරු පැදියෙන් පැමිණි දෙදෙනා මෙම වෙඩි තැබීම සිදුකර ඇති බව පරීක්ෂණවලින් අනාවරණ වි තිබෙනවාකෙසේ වෙතත් මෙම වෙඩි තැබීමට හේතුව මෙතෙක් හඳුනාගෙන නොමැති අතර සැකකරු සොයා පොලීසිය වැඩිදුර පරීක්ෂණ පවත්වන,"Saturday, 20 May 2023 - 7:16"
766,766,hirunews,Colombo,2023-05-20 00:55:56+00:00,නිලවරණය අදයි,1,178509,und,73,FALSE,ශ්‍රී ලංකා ක්‍රිකට් ආයතනයේ නිලවරණය අද,,ශ්රී ලංකා ක්රිකට් ආයතනයේ හැට දෙවැනි වාර්ෂික මහා සභා රැස්වී අද කොළඹ ජයික් හිල්ටන් හිදී පැවැත්වී නියමිත බව එම ආයතනය නිවේදන කරනවාඑමෙන්ම මෙහිදී වර්ෂ අදාළව නව නිලධාරීන මණ්ඩල පත් කර ගැනීමේ නිලවරණ ද පැවැත්වී නියමිත බව සඳහන් වන්නේ මෙම නිලවරණයේ දී තෝරා පන්කර ගනු ලබන ක්රිකට් ආයතනයේ නව නිලධාරී මඩුල්ලට කාලසීමාව සඳහා කටයුතු කිරීමට බලය හිමිව,"Saturday, 20 May 2023 - 6:23"
