,id,screen_name,location,created_at,text,retweet_count,followers_count,language,friends_count,verified,title,category,content,date
502,502,hirunews,Colombo,2023-05-31 13:41:54+00:00,කිසාගෝතමියක් වූ අපේ කාලයේ අප්පච්චි දරුවා මිය ගිය බව පිළිනොගෙන මෘත ශරීරය රැගෙන ගිහින්,1,178509,si,73,FALSE,දරුවා මිය ගිය බව පිළිනොගෙන දරුවාගේ මෘත ශරීරය රැගෙන ගිය පියා හමුවෙයි,criminal,දරුවා මිය ගිය බව පිළිනොගෙන නුවරඑළි රෝහලෙන් දරුවා මෘත ශරීරය රැගෙන ගිය පියා නුවරඑළි පොලිසිය විසින් සොයාගෙන තිබෙනවාපොලිසිය විසින් සිදු කළ මෙහෙයුමෙන් එම පියාව සොයා ගැනීමට හැකි වූ බව වාර්තා වී ඇත්තේකෙසේ වෙතත් පොලිසිය සඳහන් කළේ ඥාතීන් මිය ගිය දරුවා අවසන් කටයුතු ද සිදු කර ඇති බව පසුගිය වනදා නුවරඑළියේ සංචාරයක පැමිණි සිටි අවස්ථාව ඇති වූ අසනීප තත්ත්වයක් හේතුවෙ සිහිය නැති වීම හමුවේ මෙම දරුවා නුවරඑළි දිස්ත්රික් මහ රෝහලට ඇතුළත් කර තිබුණාදරුවා ඇතුලත් කර ගැනීමට පෙර හදිසි අවශ්යතාවයක් බැවින් වෛද්යවරු විසින් මෙම දරුවා පරික්ෂා කිරීමටයි කටයුතු කර තිබුණේඑහිදී දරුවා මිය ගොස් ඇති බව දරුවා රැගෙන ආ පියාට වෛද්යවරු සඳහන් කර සිටිය ද පියා එය නොපිළිගෙන නැවත තමන් පැමිණි වාහනයෙන්ම සිය දරුවා රැගෙන ගොස් තිබූ බව සඳහන්ඔහු ප්රකාශ කර තිබුණේ මීට පෙර ද දරුවාට මෙවැනි රෝගී තත්වයක් පවතින අතර පෞද්ගලික රෝහලක ගොස් දරුවා බේරා ගන්නා බවයිකෙසේ වෙතත් අදාළ සිද්ධිය සම්බන්ධව සැක සහිත බැවින් දරුවා පරික්ෂා කළ වෛද්යවරු නුවරඑළි පොලිසියට සිදු කළ පැමිණිල්ලක අනුවයි ඒ අනුව රෝහලේ ආරක්ෂක කැමරා පද්ධති පරීක්ෂා කර දරුවා රැගෙන රෝහලට පැමිණි රථයේ අංක හරහා කරුණු සොයා බලා සිද්ධියට සම්බන්ධ දරුවා පියා සහ පවුලේ සාමාජිකයන් නුවරඑළි පොලිසියට ගෙන්වා ගෙන තිබෙන බව වාර්තා වන්නේනුවරඑළිය පොලිසියට පැමිණි මියගිය දරුවා පියා ඇතුළු පවුලේ අය මරණ සහතිකය සහ වෛද්ය වාර්තා ඉදිරිපත් කරමින් ප්රකාශ කර තිබෙන්නේ මීට පෙර ද මෙවැනි අවස්ථා කිහිපයක දරුවා මුහුණ දුන් අතර එහිදී දරුවාට නැවත ශ්වසන කිරීමට හැකි වූ බවයිමෙවර අසනීප වූ අවස්ථාවේදී ද එවැනි දෙයක් සිදුව ඇතැයි සිතා දරුවාට මුල සිටම ප්රතිකාර ලබාගන්නා පෞද්ගලික රෝහලටම ගෙනයා කටයුතු කළ බව වැඩිදුර අදහස් දක්වමින් ඔවුන් සඳහන් කර ඇත්තේකෙසේ වෙතත් අදාළ පෞද්ගලික රෝහලට ගෙන ගිය අවස්ථාවේ දී එහි වෛද්යවරු ද සනාථ කර ඇත්තේ දරුවා මිය ගොස් ඇති බවයිඅනතුරුව දරුවා මෘත දේහය නිසි ආකාරයෙන් රෝහලින් බැහැර කර අවසන් කටයුතු ද නිසි ලෙස සිදු කර තිබෙන බව මුලික පොලිස් විමර්ශනවල දී අනාවරණ වී ඇත්තේඒ අනුව පොලිසිය ප්රකාශ කර ඇත්තේ නුවරඑළි රෝහලට දරුවා රැගෙන ගිය ද ඇතුලත් කර ගැනීමේ ලේඛනයට තොරතුරු කිසිවක් සඳහන් නොකර තිබූ වාතාවරණයක මත දරුවා මෘත ශරීරය රැගෙන ගිය පියාට කිසිදු නීතිමය ක්රියාමාර්ගයක් ගැනීමට නොහැකි බව,"Wednesday, 31 May 2023 - 18:35"
503,503,hirunews,Colombo,2023-05-31 12:38:00+00:00,බොරලැස්ගමුව පොලිසිය කපුවා කපෝති කරයි,1,178509,si,73,FALSE,පිල්ලෑව දේවාලයේ ප්‍රධාන කපුවා අත්අඩංගුවට,state,පිල්ලෑව දේවාලයේ ප්රධාන කපුවා හොරොයින් සමඟ බොරලැස්ගමුව පොලිසිය විසින් අද අත්අඩංගුව ගෙන තිබෙනවාවේරහැර වත්තේ සඳාගේ මත්ද්රව්ය තිප්පොලේ සිටිය දී ඔහුව අත්අඩංගුව ගත් බව වාර්තා වී ඇත්තේ,"Wednesday, 31 May 2023 - 17:10"
504,504,hirunews,Colombo,2023-05-31 12:34:56+00:00,හිමිකරු බෲනෝ දිවාකර අත්අඩංගුවට,3,178509,si,73,FALSE,SL Vlog' හිමිකරු බෲනෝ දිවාකර අත්අඩංගුවට (වීඩියෝ),state,අපරාධ පරීක්ෂණ දෙපාර්තමේන්තුව විසින් හිමිකරු බෲනෝ දිවාකර යන අයව අද අත්අඩංගුව ගත් බව පොලිස් මාධ්ය ප්රකාශක ජ්යේෂ්ඨ පොලිස් අධිකාරී නිහාල් තල්දූව පවසනව ඒ නතාෂා එදිරිසූරිය විසින් බෞද්ධ දර්ශනය පිළිබඳව කළ ආන්දෝලනාත්මක ප්රකාශ සම්බන්ධ පැය කට අධික කාලයක් ප්රශ්න කිරීමෙන් අනතුරුවයිනතාෂා එදිරිසූරිය හසලක තුෂාර ඇතුළු මෝඩාභිමානය ප්රහසන සංදර්ශන ප්රචාරය කිරීම සඳහාත් එමෙන් ආන්දෝලනාත්මක ප්රකාශය සිදුකිරීමෙන් අනතුරුව ඒ ගැන සමාව අයදීම සඳහාත් ඔවුන් යූ ටියුබ් චැනලය භාවිතා කර තිබුණාපසුගිය දා නමි මාධ්ය සාකච්ඡාවක් කැඳවමින් බෲනෝ දිවාකර සඳහන් කළේ නතාෂා සිදුකළ ප්රකාශයේ වගකීම ඇය විසින් බාරගත යුතු බව කෙසේ වෙතත් එම ප්රකාශ්ය පළ කිරීම සඳහා ඉඩක් ලබා දීම තමන් සිදුකළ වරදක් බව ඔහු එම මාධ්ය හමුවේ දී වැඩිදුර පැවසුවා,"Wednesday, 31 May 2023 - 18:03"
505,505,hirunews,Colombo,2023-05-31 12:19:11+00:00,තාත්තට සූදූ කෙළින්න සල්ලි නැතුව සිසුවිය පොලී මුදලාලිට විකුණලා කළුතරින් ඇසෙන අහිංසකාවියකගේ විලාපය,4,178509,si,73,FALSE,දියණිය පොලී මුදලාලිට විකුණූ පියා අත්අඩංගුවට,state,බූරුවා ගැසීමට ඇබ්බැහි වූ පියෙක් සූදූ ක්රීඩා කිරීම සඳහා මුදල් නොමැති වීම හේතුවෙ තම වැඩිමහල් දියණිය මුදල් පොලියට ලබාදෙන පුද්ගලයෙකුට අලෙවි කිරීමේ සිද්ධියක් සම්බන්ධ පොලිසිය පරීක්ෂණ ආරම්භ කර තිබෙනවාමේ පිළිබඳ තොරතුරු අනාවරණ වී ඇත්තේ මුදල් පොලියට ලබාදෙන පුද්ගලයා රහසිගතව සිසුවිය ලබා දී තිබූ ජංගම දුරකථනය ඇයගේ පුංචි අම්මා හසුවී හේතුවෙ පොලිසිය සිදුකළ විමර්ශනවල දී හෙළිවී ඇත්තේ වසර දෙකක පෙර සිය මාමා ද ඇය දූෂණ කර ඇති බවයිසැකකාර පියා ඊයේ අත්අඩංගුව ගැනීමෙ පසු දැරිය දුෂණය කළ බව කියන ඇයගේ මාමා සහ පොලී කරුවා ප්රදේශයෙන් පළා ගොස් තිබෙන බව වාර්තා වන්නේඅගලවත්ත පනාදඬුකන්ද ප්රදේශයේ නිවසක දීර්ඝ කාලයක සිට රහසිගතව සූදු පොළක පවත්වාගෙන ගොස් ඇති අතර මෙම සුදු පොළට මුදල් පොලියට් ලබාදී සඳහා වරින් වර පැමිණ තිබෙනවාඅදාළ පුද්ගලයා කලවා ප්රදේශයේ පදිංචි හැරිදි විවාහක පුද්ගලයෙක්සැකකාර පියා ද බූරුවා ගැසීමට මෙම පුද්ගලයා වරින් වර මුදල් ලබාගෙන ඇති අතර එලෙස මුදල් ලබාගැනීම සඳහා මෙම පුද්ගලයා සමඟ ඇසුර පවත්වන ලෙසට වැඩිමහල් දියණියට උපදෙස දී තිබෙන බව වාර්තා වන්නේකෙසේ වෙතත් මූලික පොලිස් විමර්ශනවල දී අනාවරණ වී ඇත්තේ සැකකාර පොලිකරුවා විසින් නිවසට පැමිණ සහ දුරකථන මාර්ගයෙන් අදාළ සිසුවිය සම්බන්ධ කරගෙන වසරේ සිට මේ වන තෙක් වසරක් පුරා විවිධ ස්ථානවල ගෙන ගොස් මෙම දැරිය දූෂණ කර ඇති බවයිසිසුවිය සම්බන්ධ කර ගැනීම සඳහා සැකකාර පොලිකරුවා විසින් හොර රහසේ සිසුවිය ජංගම දුරකථනයක ලබාදී ඇති බව එය සිසුවියගේ පුංචි අම්මා සහ බාප්පාට හසු වී දුරකථනය පොලොවේ ගසා ඒ සම්බන්ධ පොලිසියට කරන ලද පැමිණිල්ලක අනුව කළ විමර්ශනයකදී මෙම රහස් සියල් හෙළිවී තිබෙන බව වාර්තා වන්නේඒ අනුව කළ විමර්ශනවල අනුව මීට වසර දෙකක පමණ පෙර වසරේදි සිසුවියගේ මාමා කෙනෙකු වන විවාහක පුද්ගලයෙකු බිමතින් නිවසේ කිසිවෙකු නොමැති අවස්ථාව පැමිණ සිසුවිය බරපතල ලිංගික අපයෝජන කර ඇති බවට ද හෙළි වී තිබෙනවාසිසුවිය වෛද්ය පරික්ෂණය සඳහා කළුතර නාගොඩ මහ රෝහලට ඇතුළත් කර ඇති අතර සිද්ධියට අදාළව අත්අඩංගුව ගත් සැකකාර පියා අද මතුගම මහෙස්ත්රාත් අධිකරණය වෙත ඉදිරිපත් කළ බව අප ප්රාදේශීය වාර්තාකරු සඳහන් කළේ,"Wednesday, 31 May 2023 - 16:03"
506,506,hirunews,Colombo,2023-05-31 12:03:21+00:00,මතීෂ පතිරණ විශිෂ්ටතම කණ්ඩායමට වැඩි විස්තර,1,178509,si,73,FALSE,විස්ඩන් සගරාව නම් කල විශිෂ්ටතම කණ්ඩායමට මතීෂ පතිරණත්,sports,ක්රිකට් තරගාවලිය නිමා වීමත් සමගි මෙවර තරගාවලියේ විශිෂ්ටතම කණ්ඩාය සුප්රකට විස්ඩන් සගරාව විසින් නම් කර තිබෙනවාමෙම කණ්ඩායමට මෙවර තරගාවලියේ ශූරතා දිනූ චෙන්නායි සුපර් කිංග්ස් කණ්ඩායමට ක්රීඩා කළ ශ්රී ලංකා වේගපන්දු යව ක්රීඩක මතීෂ පතිරණ ඇතුළත්කර තිබීමත් කැපී පෙනෙනවාඔහු මෙවර තරගාවලියේදී තරග කට ක්රීඩා කරමින් කඩුලු ක් බිද දමන්න සමත් වුණාඒ අනුව විස්ඩන් සගරාව විසින් නම් කළ කණ්ඩාය වන්නේ ෆෆ් ඩු ප්ලේසිස්යශස්වී ජයිස්වාල්ශුබ්මන් ගිල් සූර්යකුමාර් යාදෙව් හෙන්රිච් ක්ලාසන්රින්කු සිං රවීන්ද්ර ජඩේජා රෂීඩ් ඛාන් මොහොමඩ් ශමීමොහිත් ශර්මා සහ මතීෂ පතිරණයි,"Wednesday, 31 May 2023 - 17:21"
507,507,hirunews,Colombo,2023-05-31 11:05:27+00:00,ජනපති හෙට ජාතිය අමතයි,1,178509,si,73,FALSE,ජනාධිපතිගෙන් හෙට විශේෂ ප්‍රකාශයක්,politics,ජනාධිපති රනිල් වික්රමසිංහ විසින් හෙට රාත්රී ට විශේෂ ප්රකාශයක් සිදු කිරීමට නියමිත බව ජනාධිපති මාධ්ය අංශය නිවේදනයක් නිකුත් කරමින් සඳහන් කරනවාශ්රී ලංකාවේ ආර්ථිකය ප්රකෘතිමත් කිරීම වෙනුවෙන් පසුගිය මාස ක කාලය තුළ රජය ගෙන ඇති පියවර සහ ශ්රී ලංකා රාජ්යයේ සමාජ ආර්ථික සහ දේශපාලන ප්රතිසංස්කරණ වැඩ පිළිවෙළේ ඉදිරි පියවරන් සම්බන්ධ එහිදී ඔහු විසින් විශේෂ ප්රකාශයක් සිදුකිරීමට නියමිත බව එම නිවේදනයේ සඳහන් වන්නේතවද මෙහිදී ශ්රී ලංකාවේ ජාතික පරිවර්තන මාර්ග සිතිය පිළිබඳව පැහැදිලි අවබෝධය මහජනතාව වෙත ලබාගත හැකි බව අපේක්ෂිත ඉලක්ක සාක්ෂාත් කර ගැනීම සඳහා වන මෙහෙයුම් යෝජනා ද ජනපතිවරයා විසින් ඉදිරිපත් කිරීමට නියමිත බව එම නිවේදනයේ වැඩිදුර සඳහන්,"Wednesday, 31 May 2023 - 16:18"
508,508,hirunews,Colombo,2023-05-31 10:27:32+00:00,ගෙළවැළලාගෙන මියගිය බවට සැකකෙරෙන මීගමුව ප්‍රාදේශීය ලේකම් අයේෂ් පෙරේරාගේ සිරුර ඔහුගේ නිල නිවසේ තිබී පොලිසිය සොයාගනියි ඔබත් මානසික තැවුලකින් ද අමතන්න- හෝ,2,178509,si,73,FALSE,මීගමුව ප්‍රාදේශීය ලේකම්වරයා ගෙල වැලලාගෙන මියගොස් සිටියදී හමුවෙයි,state,මීගමු ප්රදේශීය ලේකම් අයේෂ් පෙරේරා ගෙළ වැළලාගෙන සිය දිවි හානිකරගෙන තිබෙනවාප්රාදේශීය ලේකම්වරයාගේ සිරුර ඔහුගේ නිල නිවස තුළ තිබියදි සොයාගත්තේ අද පෙරවරුවේයිමීගමුව ප්රාදේශීය ලේකම් අයේෂ් පෙරේරා මහතා සිය දිවි හානිකරගෙන ඇති බව මුලින් දැක ඇත්තේ ඔහුගේ රියදුරායිසිරිත් පරිදි ප්රාදේශිය ලේකම්වරයාව කාර්යාලයට රැගෙන යෑ සඳහා පැමිණි රියදුරු ගෙළ වැළලාගෙන සිටි ලේකම්වරයා දැක තිබු අතර ඒ පිළිබදව අදාළ පර්ශ්වයන් දැනුවත කර තිබුණාඒ් අනුව පොලීසිය අද පෙරවරුවේ ප්රාදේශීය ලේකම්වරයා ගේ නිල නිවස වෙත පැමිණියාඒහිදි දැකගත හැකි වුණේ ප්රාදේශිය ලේකම්වරයා සිය නිල නිවසේ බාල්කයට දැමු ළණුවක් ආධාරයෙන් ගෙළ වැළලාගෙන සිටි අයුරුයිපසුව ප්රාදේශීය ලේකම්වරයාගේ සිරුර පශ්චා මරණ පරීක්ෂණය සඳහා මීගමු මහ රෝහලට රැගෙන ගියාඒහිදි කරන ලද පශ්චා මරණ පරීක්ෂණයෙන්ද තහවුරු වී ඇත්තේ මරණයට හේතුව ගෙළ වැළලාගැනීමක් බවයිගෙළ වැළලාගැනීමට පෙර තම රියදුරු ලියන ලද ලිපියකින් ප්රාදේඔශීය ලේකම්වරයා පවසා ඇත්තේ කම්පන දරාගත නොහැකිව මෙම තීරණය ගත් බවයිතමන් සතු මුදල් සහ බැංකු කාඩ් පත් තම මස්සිනාට ලබාදෙන ලෙසද ඔහු එම ලිපියෙන් දන්වා තිබෙනවාඅයේෂ් පෙරේරා බිරිද දරු ප්රසූතියකට සූදානම්ව සිටි නමුත් මීට සති කිහිපකට පෙර එම බිළිඳා නොසිතු ලෙස මියගොස් තිබුණාබිළිඳාගේ මියයෑම සමඟ අයේෂ් පෙරේරා මහතාගේ බිරිඳ ද දැඩි කම්පනයට පත්ව ඇති අතර ඇය මේ වන විට රාගම පුනරුත්ථාපන රෝහලේ දැඩි සත්කාර ඒ්කකයේ ප්රතිකාර ලබනවාපොලීසිය පැවසුවේ මෙම සිද්ධීන් හේතුවෙ අයේෂ් පෙරේරා මහතාද දැඩි කම්පන පත්ව සිටි බව දැනට කරන ලද පරීක්ෂණවලින් අනාවරණ වි ඇති බව,"Wednesday, 31 May 2023 - 15:49"
509,509,hirunews,Colombo,2023-05-31 09:46:46+00:00,තාක්ෂණයේ දියුණුව මානව වර්ගයාගේ පරිහානිය ද නවතම හෙළිදරව්ව මෙන්න,1,178509,si,73,FALSE,AI තාක්ෂණයේ දියුණුව ගැන තාක්ෂණ විශේෂඥයින්ගෙන් අනතුරු ඇගවීමක්,state,කෘත්රිම බුද්ධි තාක්ෂණ උපරිම දියුණුවත් සමඟ මානව වර්ගයා පරිහානිය සිදුවිය හැකි බවට තොරතුරු තාක්ෂණ විශේෂඥයින් අනතුරු අඟවා තිබෙනවාමෙම අනාවරණ සිදු කර තිබුණේ ඕපන් සහ ගූගල් සමාගමේ විශේෂඥයින් පිරිසක් විසින් වන අතර කෘත්රිම බුද්ධි ආරක්ෂණ මධ්යස්ථානයේ වෙබ් අඩවිය තුළ මේ සම්බන්ධ තොරතුරු වාර්තා කර තිබූ බව සඳහන් එම ආයතන පෙන්වා දෙන්නේ කෘත්රිම බුද්ධිය යොදාගෙන රසායන අවි නිපදවීම සහ අසත්ය තොරතුරු ප්රචාරණ කර මිනිසුන් වැරදි තීරණ ගැනීමට පෙළඹවීම ඇතුළු විවිධ සාපරාධි ක්රියාවන් සිදු කල හැකි බව ඔවුන් පෙන්වා දෙන්නේඑමගින් උද්ගත විය හැකි අවදානම අවම කිරීම ගෝලීය ප්රමුඛතා ලෙස සලකා කටයුතු කිරීමේ වැදගත්කමත් මෙහිදී ඔවුන් අවධාරණ කර තිබෙනව,"Wednesday, 31 May 2023 - 14:44"
510,510,hirunews,Colombo,2023-05-31 08:02:16+00:00,ඔබත් ඌරන් ඇති කරනවාද එසේනම් මේ පණිවිඩය ඔබටයි,1,178509,si,73,FALSE,ඌරන් ඇති කරන ගොවිපළවලට දැනුම් දීමක්,state,වෛරස් රෝගය හේතුවෙ බස්නාහිර පළාත තුළ ගොවිපලවලින් ඌරන් පිටත රැගෙන යාමේදී ප්රදේශයේ පශු වෛද්ය කාර්යාල හරහා අවසර ලබාගත යුතු බව බස්නාහිර පළාත් සත්ත්ව නිෂ්පාදන සහ සෞඛ්ය දෙපාර්තමේන්තුවේ අධ්යක්ෂ කේකේ සරත් ප්රකාශ කළා ඔහු පවසා සිටියේ බස්නාහිර පළාතේ ඌරන් ඇතිකරන ගොවිපළ කිහිපයකි මෙම වෛරස් රෝගී තත්වය වාර්තාව ඇති බව,"Wednesday, 31 May 2023 - 9:19"
511,511,hirunews,Colombo,2023-05-31 06:29:44+00:00,යුරියා මිල පහළට නව මිල මෙන්න,1,178509,si,73,FALSE,යුරියා මිල පහළට,state,යුරියා මිල අඩුකිරීම පියවර ගන්නා බව කෘෂිකර්ම අමාත්ය මහින්ද අමරවීර මහතා පවසනවාඒ අනුව ජූනි වනදා සිට යුරියා කිලෝ මිටියක් රුපියල් කට ගොවීන් ලබාගත හැකි බව ඔහු පවසන්නේ,"Wednesday, 31 May 2023 - 11:48"
