,id,screen_name,location,created_at,text,retweet_count,followers_count,language,friends_count,verified,title,category,content,date
259,259,hirunews,Colombo,2023-06-12 12:16:20+00:00,' බස් එකේ ෆිනෑන්ස් එකහිරවෙලා ඒක ගෙවන්න ගුණේගෙන් සල්ලි ඉල්ලුව ගමන් තමයි වෙඩි තියන්න කන්ට්‍රක්ට් එක දුන්නෙ '' රටම කැළඹූ වෙඩි තැබීමේ ඇත්ත මෙන්න කවුරුත් නොදන්න කතාව,3,178509,si,73,FALSE,මීගොඩ වෙඩි තැබීමේ සුල මුල,criminal,බස් එකේ ෆිනෑන්ස් එක හිරවෙලා ඒක ගෙවන්න ගුණේගෙන් සල්ලි ඉල්ලුව ගමන් තමයි වෙඩි තියන් කන්ට්රෑක්ට් එක දුන්නේමේ මීගොඩ ප්රදේශයේ පසුගිය පස්වැනිදා රක්ෂණ සමාගමක සභාපතිවරයෙකුට වෙඩි තබා බරපතළ තුවාල සිදුවීමේ කොන්ත්රාත්තු ලබාගත් පුද්ගලයා අනාවරණයයිපසුගිය පස්වන දින උදෑසන රක්ෂණ සමාගමක නවක සභාපතිවරයකු නාඳුනන පුද්ගලයෙකු මීගොඩ ප්රදේශයේ ඔහු නිවසින් බැහැරට කාර් රථයෙන් යන අවස්ථාවේ දී වෙඩි තබා බරපතළ තුවාල සිදු කර තිබුණිඑහෙත් එම වෙඩි තැබීම සිදු කර සාක්ෂි කිසිවක් ඉතුරු නොකර වෙඩික්කරුවන් පලා යාමට සමත් වී තිබුණිඒ අනුව එම පිරිස සෙවීමේ කාර්ය බස්නාහිර පළාත් භාර ජ්යෙෂ්ඨ නියෝජ්ය පොලිස්පති දේශබන්දු තෙන්නකෝන් විසින් බස්නාහිරදකුණ අපරාධ කොට්ඨාසය වෙත පවරන ලදී පොලිස් පරීක්ෂණ ඇරඹේ පළමු පියවර ලෙස සීසීටීවී දර්ශන පරීක්ෂාව සිදු කළ ද වෙඩික්කරු දිව යන දර්ශන මෙන්ම කිලෝමීටර පමණ දුරින් නවතා තිබු යතුරු පැදියක නැඟ යන අයුරු පළමු නිරීක්ෂණ වියඑහෙත් ඉන් අනතුරුව යතුරු පැදියෙන් අතුරුදන් වූ වෙඩික්කරු පිළිබඳව සොයා ගැනීමේ ගැටළුව මුහුණ දීමට පොලිස් නිලධාරීන්ට සිදුවියඒ කිලෝමීටර දුරින් ඔහු යතුරුපැදියෙන් බැස අතුරුදන් වූ හෙයිනිඋත්සාහය අත් නොහළ පොලිස් නිලධාරීන කිලෝමීටර ක් පමණ දුරක මාර්ග කීපයක් ඔස්සේ සීසීටීවී දර්ශන පරීක්ෂාවක් නිරත වුණා එක් ස්ථානයකදී ඔවුන්ට නිරීක්ෂණ වන්නේ යතුරු පැදියෙන් බැස ගත් වෙඩිකරු ත්රීරෝද රථයක ගොඩ වන අයුරුයඑහෙත් ත්රිරෝද රථයේ අංක පැහැදිලි නොමැති බැවින් පසුව පොලිස් නිලධාරීන විවිධ උපක්රම භාවිත කරමින් ත්රීරෝද රථයේ අංක සොයා ගත්තේ විමර්ශන නිලධාරීන්ගේ දක්ෂතාවය පිළිබිඹු කරමිනිත්රීරෝද රථයේ අංක පරීක්ෂා කිරීමෙන් හොරණ ප්රදේශයේ ලිපිනයක් සොයා ගැනීමට නිලධාරීන්ට හැකි වියහොරණ ප්රදේශයේ තිබූ ලිපිනයට ගිය පොලිස් නිලධාරීන්ට එම ලිපින සහිත නිවසෙහි මිදුලෙහි ත්රිරෝද රථය නවතා තිබෙනු දුටු විට මහත් අස්වැසිල්ලක් වියඑම නිවස වැටලූ පොලිස් නිලධාරීන එම නිවසේ සිටි පුද්ගලයන් දෙදෙනෙකු සැකපිට අත්අඩංගුව ගෙන ප්රශ්න කිරීම ආරම්භ කලෝය සැකකරු සියල් වමාරයි සර් මම අයිස් ගහල නන්නත්තාර වෙලා හිටියේ මට කුමාර කතා කරලා වැඩක් තියෙනවා කියලා එන්න කිව්වා මම ඇවිල් වැඩේ බැලුවා කරන්න පුළුවන් කියලා හිතුනා මට ඉල්ලපු තුවක්කුව සහ බුලට් හයක් දුන්නා මම වෙඩි තිබ්බත් ඌ මැරුණේ නැහැ මම වාහනය ඉස්සරහටම එනකොටම පැනලා වීදුරුවට එක වෙඩිල්ල තිබ්බා වෙඩිපහර කාගෙනම කාර් එක ඉස්සරහ ගියා මං පන්නලා ගිහිල්ලා තවත් වෙඩි පාරවල් තුනක් ම තිබ්බා යනු එතැන සිටි වෙඩික්කරු වූ හිටපු යුධ හමුද සෙබල පොලිසියට පැවසීයඑම නිවසේ සිටි අනෙක පුද්ගලයා සීසීටීවී දර්ශනවල යතුරු පැදිය පැදවූ පුද්ගලයා විය සර් මට බබා කිව්වේ බයි එක පැදලා ඔත්තු බලන්න කියල මම වැඩේ කරල දුන්නා මහ මොළකරු සොයා පොලිසිය යයි මේ සියලුම කරුණු විශ්ලේෂණ කර පසුව පොලිස් නිලධාරීන කොන්ත්රාත්තු ලබා ගත් පුද්ගලයා සොයා යාමට කටයුතු කළෝයඔහු අත්අඩංගුව ගෙන ප්රශ්න කිරීමේ ඔහු මෙලෙස පවසා සිටියේ සර් ගුණේ මගේ යාළු මට වාහනයට ෆිනෑන්ස් දාන් ඕන නිසා ගුණයගෙන් සල්ලි ඉල්ලුවාම සැලකිය යුතු මුදලක් දෙන්නම කියලා මේ වැඩේ කරන්න කියලා බාර දුන්නා මට සල්ලි ඕන නිසා වැඩේ බාරගත්ත සර් මම නෙමෙයි වැරදිකාර මාතර ගුණේ පොලිස් නිලධාරීන ගුණේ සොයාගෙන මාතරට යාමට පිටත් වියමාතර ප්රදේශයේ නිවසේ දී අත්අඩංගුව ගත් ගුණයේ වෙඩි ප්රහාරයට ලක්වූ රක්ෂණ සමාගම් සභාපතිවරයා මාතර ශාඛා කළමනාකාරවරයා සේම හිටපු නාගරික මන්ත්රීවරයෙක් බවද පොලිස් නිලධාරීන්ට අනාවරණ වුණාසර් මමයි රක්ෂණ සමාගමේ හිටපු සභාපති එකතු වෙලා කරපු හොරකමක මූ අල්ලල දුන්නා ඒ නිසා මම හිටියේ ලොකු කේන්තියකින් අනිත් එක ඌ තමයි ඊළඟ සභාපති වෙන්න හිටියේ ඒ නිසාම මරලා දාන් ඕන කියලා මම කොන්තරාත්තුව දුන්නා ඒත් මුන්ට ඌව මරා ගන්න බැරි වුණා මම දුන්නෙ ලක්ෂ එකහමාරයි මම තමයි උන් තුවක්කුව දුන්නේ උණ්ඩ හයකුත් එක්ක ඒක ගත්තෙ නැහැ තවම ඒක උන් ළඟමාතර කළමනාකාර ගුණේ පොලිසිය හමුවේ හඬා වැටෙමින් අකුර නෑර පවසා සිටියේ කිරීමට වෙනත් කිසිදු දෙයක් ඉතිරි වී නොමැති හෙයිනිපොලිස් පරීක්ෂක හේමන්ත කුමාර සහ උප පොලිස් පරීක්ෂක රුක්ෂාන් බණ්ඩාර හොරණ නිවසක පිටුපස රබර් කැලෑවක මඩුවක වහල ගසා තිබිය දි පිස්තෝල අවිය සහ ඔවුන්ගේ අත ඉතිරිව තිබූ උන්ඩ දෙක සොයාගෙන තිබුණිමාතර ශාඛා කළමනාකාර ගුණේ සතුව තිබී බලපත්ර සහිත ගිනි අවියක්ද පොලිස් භාරය ගත්තේය වෙඩි තැබීමට පැමිණි පිරිස දින ගණනාවක් මීගොඩ ප්රදේශයේ කරක් ගසමින් තොරතුරු සොයා බැලීමට කටයුතු කළ ද ඔවුන්ගේ ඉලක්කය සපුරා ගැනීමට නොහැකි වීම ගැන කළමනාකාර ගුණේ සිටියේ නොසතුටිනි පොලිස් නිලධාරීන්ගේ කඩිනම් විමර්ශන හේතුවෙ නැවත අපරාධය මුල පිරී ඉඩ නොතබා සැකකරු අත්අඩංගුව ගැනීමට හැකි විය,"Monday, 12 June 2023 - 17:26"
260,260,hirunews,Colombo,2023-06-12 12:10:07+00:00,භාණ්ඩ ට වැඩි ප්‍රමාණයක් කිසිදු බද්දක් රහිතව අපනයනය කිරීමට අවසර,3,178509,si,73,FALSE,භාණ්ඩ 7000ට කිසිදු බද්දක් රහිතව එක්සත් රාජධානියට අපනයනය කිරීමට අවස්ථාව,state,එක්සත රාජධානි නව ජීඑස්පී වෙළෙඳ යෝජනා ක්රමය හරහා භාණ්ඩ කට වැඩි ප්රමාණය කිසිදු බද්ද රහිත එරට වෙළෙඳපොළ වෙත අපනයනය කිරීමට මෙරට දේශීය ව්යවසායකයන් අවස්ථාව හිමි වන බව වෙළෙඳ වාණිජ හා ආහාර සුරක්ෂිතතා අමාත්ය නලින් ප්රනාන්ද පවසනවාතීන්ත කර්මාන්තය හා ටයිල් කර්මාන්තය ආශ්රිත නිෂ්පාදන සමාගම්හි විධායක නිළධාරීන් සමඟ ඉදිකිරීම් ක්ෂේත්රය ආශ්රිත කර්මාන්තයන් නැවත යථාතත්ත්වයට පත් කිරීම වෙනුවෙන් වෙළෙඳ අමාත්යාංශයේදී අද දින පවත්වනු ලැබූ සාකච්ඡාවකදී අමාත්යවරය මෙම අදහස් පළ කර සිටියාපසුගියදා පොදු රාජ්ය මණ්ඩලීය වෙළෙඳ අමාත්යවරු හමුව සඳහා එක්සත රාජධානි නිළ සංචාරයක නිරත වූ අමාත්යවරය ඉදිරියේදී එක්සත රාජධානි නව ජීඑස්පී වෙළෙඳ යෝජනා ක්රමය හරහා දේශීය භාණ්ඩ කට වැඩි ප්රමාණය කිසිදු බද්ද රහිත එක්සත රාජධානි වෙත අපනයනය කිරීමට හැකි බවද බංගලාදේශ සමඟ වෙළෙඳ ගිවිසුම හරහාද මෙරට නිෂ්පාදක සඳහා පුළුල් අවස්ථාව රාශියක උදා වන බව එම වාසිදායක අවස්ථාවන්ගෙන් නිසි ප්රයෝජන ගැනීම තුළින් සිය ව්යාපාරයද රටද දියුණු කර ගැනීම උදෙස කටයුතු කරන ලෙසද ඉල්ලීමක් කළ බව වාර්තා වී ඇත්තේඑම ව්යාපාරික අවස්ථාව පිළිබදව දේශීය නිෂ්පාදකයින් දැනුවත කිරීමේ වැඩමුළුවක් සංවිධානය කරන ලෙසට ලෙසට වාණිජ දෙපාර්තමේන්තු නිළධාරීන්ට උපදෙස ලබා දෙන බව වර්තා වන්නේමෙහිදී අමාත්යවරය සඳහන් කළේ අත්යාවශ්ය ද්රව්ය ඇතුළු ආනයනික භාණ්ඩ මිල ගණන් ඩොලර වෙනස්වී සාපේක්ෂ සැළකිය යුතු අන්දමින් පහළ ගිය දේශීය නිෂ්පාදන කර්මාන්තයන්හි මිල ගණන් අඩු නොවී ගැටලුවක් බව රජය මගි දේශීය නිෂ්පාදකයින් දිරිමත් කිරීම වෙනුවෙන් ආනයනයන් සීම කළද ඉන් අයුතු ප්රයෝජන ගෙන අනවශ්ය ලෙස අතිවිශාල ලාභ ලබා ගැනීමට හෝ පසුගිය අර්බුධ සමයේ ලැබූ අලාභ පාරිභෝගික අපහසුතාවයට පත් කරමින් යලි පියවා ගැනීමට උත්සහ නොදැරිය යුතු බවද අමාත්යවරය මෙහිදී සඳහන් කර තිබෙනවාමේ වන විට රජය මගි ණය පහසුකම ලබා ගැනීම ලබා ගෙන ඇති ණය ප්රතිව්යුහගත කිරීමඋද්ධමනය ප්රතිශතයක ලෙස තනි අගයක් කරා ගෙන ඒම හා බැංකු පොළී අනුපාත පහත දැමීම ආදී ආර්ථික අවපාත තත්ත්වයෙන් මිදී සඳහා හැකි සෑම පියවරක් ගනිමින් පවතින අතරඒ සඳහා නිෂ්පාදන කර්මාන්ත ක්ෂේත්රයන් ආශ්රිත යළි පිබිදීමක් ඇති කිරීම වෙනුවෙන් එම නිෂ්පාදනයන් මිල ගණන් පහත හෙළිය යුතු බවද අමාත්යවරය සඳහන් කර සිටියාරජය විසින් සෞඛ්ය අධ්යාපනය ආදී තවත් ප්රමුඛ ක්ෂේත්රයන් පවතිත්දීත් රුපියල් බිලියන ක මුදලක් කොන්ත්රාත්කරු වෙත ලබා දුන්නේ රට තුළ යළි මුදල් සංසරණ වේගවත් කිරීම තුළින් ආර්ථිකය ප්රකෘතිමත් කිරිම සඳහා බවද අමාත්යවරය ප්රකාශ කර තිබෙනවාඅමාත්යවරයා වැඩිදුර පවසා සිටියේ යම් භාණ්ඩ සඳහා උපරිම සිල්ලර මිලක් පැනවූ පසු එම මිලට එම භාණ්ඩ අලෙවි කළ යුතු බව සඳහන් කළ එම උපරිම මිල සාධාරණීකරණය කිරීම වෙනුවෙන් අදාළ ආයතනය සතුව ඊට අදාළ ලියකියවිලි පැවතිය යුතු අතර අවශ්යතාවයකදී ඒවා පාරිභෝගික කටයුතු පිළිබ අධිකාරියට ඉදිරිපත් කළ යුතු බවයිඉදිරි වසර ක කාළය තුළ රජය මහා පරිමාණ ඉදිකිරීම් ආශ්රිත ව්යාපෘ දියත් නොකරන බව සඳහන් කළ අමාත්යවරය පවතින ආර්ථික තත්ත්වය යටතේ නිසි ප්රයෝජන නොමැති එවැනි ව්යාපෘ කිහිපයක් කැබිනට් මණ්ඩලයේ අනුමැති මත නවතා දැමූ බවද සඳහන් කර තිබෙනවාඒ අනුව සාමාන් ජනතාව ඉලක්ක කර ගනිමින් නව තාක්ෂණික ක්රමවේදයන් ඔස්සේ අඩු පිරිවැය සහිත අමුද්රව්ය තුළින් සිදු කරන ඉදිකිරීම් සුළභ කිරීමට ඉදිකිරීම් ක්ෂේත්රය යොමු විය යුතු බවද අමාත්යවරය මෙහිදී පවසා සිටියා,"Monday, 12 June 2023 - 16:35"
261,261,hirunews,Colombo,2023-06-12 11:50:20+00:00,අමරකීර්ති අතුකෝරල ඝාතනය සම්බන්ධයෙන් නඩුවට විශේෂ ත්‍රිපුද්ගල විනිසුරු මඩුල්ලක්,1,178509,si,73,FALSE,මන්ත්‍රී අමරකීර්ති අතුකෝරල ඝාතනය සම්බන්ධයෙන් නඩුවට විශේෂ ත්‍රිපුද්ගල විනිසුරු මඩුල්ලක්,criminal,හිටපු පාර්ලිමේන්තු අමරකීර්ති අතුකෝරළ සහ ඔහුගේ ආරක්ෂාවට සිටි පොලිස් නිලධාරියා පහරදී ඝාතන කිරීම සම්බන්ධ වන නඩුව විභාග කිරීම සඳහා විශේෂ ත්රිපුද්ගල විනිසුරු මඩුල්ලක පත්කර තිබෙනව නීතිපතිවරයාගේ ඉල්ලීම පරිදි මෙම පත්කිරීම සිදුකර ඇත්තේ අගවිනිසුරු ජයන්ත ජයසූරිය විසින් මෙලෙස පත්කරන ලද ත්රිපුද්ගල විනිසුරුවරු වන්නේ සහන් යාපා බණ්ඩාර රශ්මි සින්ගප්පුලි සහ රුව පතිරණයිමෙම සිද්ධියට අදාළව විත්තිකරුවන දෙනෙකුට එරෙහි නීතිපතිවරයා විසින් ගම්පහ මහාධිකරණ හමුවේ අධි චෝදනා ගොනු කර තිබෙනව එම නඩුව ලබන වනදා කැඳවීමට නියමිතයි පසුගිය වසරේ මැයි මස වනදා හිටපු පාර්ලිමේන්තු මන්ත්රී අමරකීර්ති අතුකෝරළ සහ ඔහුගේ ආරක්ෂාවට සිටි පොලිස් නිලධාරියා පහරදී ඝාතන කෙරුණේ නිට්ටඹුව නගර මධ්යයේදී,"Monday, 12 June 2023 - 17:03"
262,262,hirunews,Colombo,2023-06-12 11:12:25+00:00,ගොවීන්ට හෙට සිට පොහොර,1,178509,si,73,FALSE,පොළොන්නරුවේ ගොවීන්ට හෙට සිට වවුචර්පත්වලට පොහොර,state,පොළොන්නරුවේ ගොවීන් යුරියා පොහොර මිලදි ගැනීම සදහා ලබාදි ඇති වවුචර්පත්වලට හෙට සිට පොහොර මිලදි ගත හැකි බව ලංකා සහ කොමර්ෂල් පොහොර සමාගම් පවසනවාකොළඹ වරායට පැමිණි යුරියා පොහොර මෙටි්රක් ටොන් ක් සහිත නෞකාවේ පොහොර ගොඩබෑම අද පස්වරුවේ ආරම්භ කෙරෙන බව එම සමාගම් සභාපති ආචාර් ජග පෙරේරා ප්රකාශ කළේ ඊයේ එම නෞකාවෙන් පොහොර ගොඩබෑම කටයුතු සදහා සුදානම් වුවද පැවති අධික වැසි සහිත තත්ත්වය හේතුවෙ එය සිදුකිරීමට නොහැකි වු බව කෘෂිකර්ම අමාත්යාංශ කියා සිටියේ,"Monday, 12 June 2023 - 15:09"
263,263,hirunews,Colombo,2023-06-12 10:21:41+00:00,පුරාවිද්‍යා දෙපාර්තමේන්තුවේ අධ්‍යක්ෂ ජනරාල් ඉල්ලා අස් වෙයි,2,178509,si,73,FALSE,පුරාවිද්‍යා දෙපාර්තමේන්තුවේ අධ්‍යක්ෂ අනුර මනතුංග ජනරාල් ඉල්ලා අස් වෙයි,state,පුරාවිද්ය අධ්යක්ෂ ජනරාල් මහාචාර්ය අනුර මනතුංග සිය ධූරයෙ ඉල්ලා අස් වී තිබෙනව ඔහු හිරු ප්රවෘත්ති අංශය සදහන් කළේ පෞද්ගලික හේතුවක් මත තමන් ධුරයෙන් ඉල්ලා අස්වූ බව ඉදිරියේදී කැළණිය විශ්වවිද්යාලයේ පුරාවිද්ය පිළිබදව ජ්යෙෂ්ඨ මහාචාර්ය තනතුරේ කටයුතු කරන බවද පුරාවිද්ය අධ්යක්ෂ ජනරාල්වරයා වැඩිදුර සදහන් කළා,"Monday, 12 June 2023 - 15:42"
264,264,hirunews,Colombo,2023-06-12 09:59:38+00:00,විනය ක්‍රියාමාර්ග නොගන්නා බවට සභාපති මෛත්‍රීගෙන් ලිපියක්,2,178509,si,73,FALSE,මෛත්‍රීපාල සිරිසේනගෙන් විශේෂ ලිපියක්,politics,ශ්රී ලංකා නිදහස් පක්ෂයේ අමාත්ය ධුර සහ රාජ්ය අමාත්ය ධූර භාරගත් නිමල් සිරිපාල ද සිල්වා මහින්ද අමරවීර ඇතුළු දෙනා එරෙහි විනය ක්රියාමාර්ග නොගන්න බව දන්වමි එම පක්ෂයේ සභාපති මෛත්රීපාල සිරිසේන ලිපි නිකුත් කර තිබෙනව,"Monday, 12 June 2023 - 15:15"
265,265,hirunews,Colombo,2023-06-12 09:29:23+00:00,ඉතාලියේ හිටපු අගමැති මියයයි,1,178509,si,73,FALSE,ඉතාලියේ හිටපු අගමැති මියයයි,politics,ඉතාලි හිටපු අග්රාමාත් සිල්වි බර්ලුස්කෝනි ජීවිතක්ෂ පත්ව තිබෙනව හැවිරිදි වියේ පසු වූ ඔහු ඉතාලි මිලානෝ නුවර රෝහලක ප්රතිකාර ලබමින් සිටියදී එලෙස ජීවිතක්ෂ පත්ව ඇති බව විදෙස් මාධ්ය වාර්තා සඳහන් කළේ වර්ෂයේදී අගමැති ධුරයට පත්වූ ඔහු අවස්ථා කදී ඉතාලි අග්රාමාත් ධුරය හොබවා තිබෙන බව වාර්තා වී ඇත්තේ,"Monday, 12 June 2023 - 14:56"
